{
  "$schema": "https://json-schema.org/draft/2020-12/schema",
  "$id": "lp.content.activity",
  "title": "Learning Platform activity",
  "description": "Reusable activity. Behaviour comes from its block sequence, not from a hard-coded engine type.",
  "type": "object",
  "additionalProperties": false,
  "required": ["schema", "schemaVersion", "id", "version", "metadata", "relationships", "blocks"],
  "properties": {
    "schema": { "const": "lp.content.activity" },
    "schemaVersion": { "type": "string", "pattern": "^[0-9]+\\.[0-9]+\\.[0-9]+$" },
    "id": { "type": "string", "minLength": 1 },
    "version": { "type": "string", "pattern": "^[0-9]+\\.[0-9]+\\.[0-9]+$" },
    "metadata": {
      "type": "object",
      "required": ["title", "status"],
      "properties": {
        "title": { "type": "string", "minLength": 1 },
        "status": { "enum": ["planned", "available", "archived"] },
        "summary": { "type": "string" },
        "href": { "type": ["string", "null"] }
      }
    },
    "relationships": {
      "type": "object",
      "properties": {
        "learningOutcomes": { "type": "array", "items": { "type": "string" } },
        "questions": { "type": "array", "items": { "type": "string" } },
        "assets": { "type": "array", "items": { "type": "string" } },
        "prerequisites": { "type": "array", "items": { "type": "string" } }
      }
    },
    "blocks": {
      "type": "array",
      "items": { "$ref": "lp.content.block" }
    }
  }
}
