[
  {
    "schema": "lp.content.activity",
    "schemaVersion": "0.1.0",
    "id": "week-1-baseline-diagnostic",
    "version": "0.1.0",
    "metadata": {
      "title": "Baseline programming diagnostic",
      "status": "available",
      "summary": "A low-stakes check of starting knowledge before Week 1 teaching. Not a formal OCR assessment and not a grade.",
      "href": null
    },
    "relationships": {
      "learningOutcomes": [
        "LO1"
      ],
      "assignment": "A1",
      "criteria": [
        "P1"
      ],
      "questions": [],
      "assets": []
    },
    "blocks": [
      {
        "schema": "lp.content.block",
        "schemaVersion": "0.1.0",
        "id": "w1-base-h",
        "version": "0.1.0",
        "metadata": {},
        "relationships": {},
        "type": "heading",
        "content": {
          "text": "Before we start",
          "level": 4
        }
      },
      {
        "schema": "lp.content.block",
        "schemaVersion": "0.1.0",
        "id": "w1-base-p",
        "version": "0.1.0",
        "metadata": {},
        "relationships": {},
        "type": "paragraph",
        "content": {
          "text": "This diagnostic helps you and your teacher see what you already know about software, data and input/output. It does not count toward Assignment 1 or P1."
        }
      },
      {
        "schema": "lp.content.block",
        "schemaVersion": "0.1.0",
        "id": "w1-base-q1",
        "version": "0.1.0",
        "metadata": {},
        "relationships": {},
        "type": "single-choice",
        "content": {
          "formative": true,
          "questionId": "u14-w1-base-q1",
          "prompt": "Which of these is the best description of software used in a workplace?",
          "options": [
            {
              "id": "a",
              "label": "A set of programs that store, process or present business information"
            },
            {
              "id": "b",
              "label": "Only the physical keyboard and screen"
            },
            {
              "id": "c",
              "label": "A printed staff handbook"
            }
          ],
          "correctOptionId": "a",
          "feedback": {
            "correct": "Software is the programs a business uses to handle information.",
            "incorrect": "Think about programs that store or process information, not the hardware or paper records."
          }
        }
      },
      {
        "schema": "lp.content.block",
        "schemaVersion": "0.1.0",
        "id": "w1-base-q2",
        "version": "0.1.0",
        "metadata": {},
        "relationships": {},
        "type": "single-choice",
        "content": {
          "formative": true,
          "questionId": "u14-w1-base-q2",
          "prompt": "Which value is a Boolean?",
          "options": [
            {
              "id": "a",
              "label": "\"Smith\""
            },
            {
              "id": "b",
              "label": "17"
            },
            {
              "id": "c",
              "label": "True"
            },
            {
              "id": "d",
              "label": "12.50"
            }
          ],
          "correctOptionId": "c",
          "feedback": {
            "correct": "Boolean values are True or False.",
            "incorrect": "Boolean means True or False, not text or a number."
          }
        }
      },
      {
        "schema": "lp.content.block",
        "schemaVersion": "0.1.0",
        "id": "w1-base-q3",
        "version": "0.1.0",
        "metadata": {},
        "relationships": {},
        "type": "single-choice",
        "content": {
          "formative": true,
          "questionId": "u14-w1-base-q3",
          "prompt": "In Python, what does input() do?",
          "options": [
            {
              "id": "a",
              "label": "Displays a value on screen"
            },
            {
              "id": "b",
              "label": "Reads text typed by the user"
            },
            {
              "id": "c",
              "label": "Saves the program to GitHub"
            }
          ],
          "correctOptionId": "b",
          "feedback": {
            "correct": "input() reads text from the user.",
            "incorrect": "print() displays output. input() reads what the user types."
          }
        }
      },
      {
        "schema": "lp.content.block",
        "schemaVersion": "0.1.0",
        "id": "w1-base-q4",
        "version": "0.1.0",
        "metadata": {},
        "relationships": {},
        "type": "short-response",
        "content": {
          "questionId": "u14-w1-base-q4",
          "prompt": "Have you written a program before? If yes, which language? If no, write 'No previous programming'.",
          "guidance": "Thank you. This is a starting-point note for you and your teacher, not a mark."
        }
      },
      {
        "schema": "lp.content.block",
        "schemaVersion": "0.1.0",
        "id": "w1-base-note",
        "version": "0.1.0",
        "metadata": {},
        "relationships": {},
        "type": "callout",
        "content": {
          "tone": "info",
          "title": "Formative only",
          "text": "Correct options for these checks are stored in the hub as low-stakes formative material. They are not secure assignment evidence."
        }
      }
    ]
  },
  {
    "schema": "lp.content.activity",
    "schemaVersion": "0.1.0",
    "id": "week-1-business-data-explorer",
    "version": "0.1.0",
    "metadata": {
      "title": "Business data explorer",
      "status": "available",
      "summary": "Connect software in a workplace to the data it stores, then classify business values using integer, floating point, string and Boolean.",
      "href": null
    },
    "relationships": {
      "learningOutcomes": [
        "LO1"
      ],
      "assignment": "A1",
      "criteria": [
        "P1"
      ],
      "questions": [],
      "assets": []
    },
    "blocks": [
      {
        "schema": "lp.content.block",
        "schemaVersion": "0.1.0",
        "id": "w1-biz-p1",
        "version": "0.1.0",
        "metadata": {},
        "relationships": {},
        "type": "paragraph",
        "content": {
          "text": "Businesses use software to take orders, store customer details, calculate prices and record whether a delivery is required. Those programs only work if each piece of data has an appropriate type."
        }
      },
      {
        "schema": "lp.content.block",
        "schemaVersion": "0.1.0",
        "id": "w1-biz-p2",
        "version": "0.1.0",
        "metadata": {},
        "relationships": {},
        "type": "paragraph",
        "content": {
          "text": "A local supplier takes telephone orders. Classify each piece of order data."
        }
      },
      {
        "schema": "lp.content.block",
        "schemaVersion": "0.1.0",
        "id": "w1-biz-class",
        "version": "0.1.0",
        "metadata": {},
        "relationships": {},
        "type": "classification",
        "content": {
          "formative": true,
          "questionId": "u14-w1-biz-class",
          "prompt": "Choose the most appropriate fundamental data type for each item.",
          "categories": [
            {
              "id": "integer",
              "label": "Integer"
            },
            {
              "id": "floating-point",
              "label": "Floating point"
            },
            {
              "id": "string",
              "label": "String"
            },
            {
              "id": "boolean",
              "label": "Boolean"
            }
          ],
          "items": [
            {
              "id": "customer-name",
              "label": "Customer name",
              "correctCategoryId": "string"
            },
            {
              "id": "item-quantity",
              "label": "Number of items",
              "correctCategoryId": "integer"
            },
            {
              "id": "unit-price",
              "label": "Unit price",
              "correctCategoryId": "floating-point"
            },
            {
              "id": "delivery-flag",
              "label": "Delivery required",
              "correctCategoryId": "boolean"
            }
          ],
          "feedback": {
            "correct": "Name is text, quantity is a whole number, price may include pence, and delivery is yes/no.",
            "incorrect": "Ask: is it text, a whole number, a number that may include a fraction, or true/false?"
          }
        }
      },
      {
        "schema": "lp.content.block",
        "schemaVersion": "0.1.0",
        "id": "w1-biz-why",
        "version": "0.1.0",
        "metadata": {},
        "relationships": {},
        "type": "short-response",
        "content": {
          "questionId": "u14-w1-biz-why",
          "prompt": "Why is a floating point type more appropriate than an integer for a product price?",
          "guidance": "A price can include a fractional amount, such as 12.50. An integer can only store whole numbers."
        }
      },
      {
        "schema": "lp.content.block",
        "schemaVersion": "0.1.0",
        "id": "w1-biz-ref",
        "version": "0.1.0",
        "metadata": {},
        "relationships": {},
        "type": "reflection",
        "content": {
          "questionId": "u14-w1-biz-ref",
          "prompt": "Name one workplace system you have seen (till, booking, stock). What data does it store?"
        }
      },
      {
        "schema": "lp.content.block",
        "schemaVersion": "0.1.0",
        "id": "w1-biz-note",
        "version": "0.1.0",
        "metadata": {},
        "relationships": {},
        "type": "callout",
        "content": {
          "tone": "info",
          "title": "Formative classification",
          "text": "Expected types are included in this activity JSON for instant feedback. This is not Assignment 1 marking."
        }
      }
    ]
  },